Title,Price,Availability,Rating
Sharp Objects,£47.82,In stock,Four
"In a Dark, Dark Wood",£19.63,In stock,One
The Past Never Ends,£56.50,In stock,Four
A Murder in Time,£16.64,In stock,One
The Murder of Roger Ackroyd (Hercule Poirot #4),£44.10,In stock,Four
The Last Mile (Amos Decker #2),£54.21,In stock,Two
That Darkness (Gardiner and Renner #1),£13.92,In stock,One
Tastes Like Fear (DI Marnie Rome #3),£10.69,In stock,One
A Time of Torment (Charlie Parker #14),£48.35,In stock,Five
A Study in Scarlet (Sherlock Holmes #1),£16.73,In stock,Two
Poisonous (Max Revere Novels #3),£26.80,In stock,Three
Murder at the 42nd Street Library (Raymond Ambler #1),£54.36,In stock,Four
Most Wanted,£35.28,In stock,Three
Hide Away (Eve Duncan #20),£11.84,In stock,One
Boar Island (Anna Pigeon #19),£59.48,In stock,Three
The Widow,£27.26,In stock,Two
Playing with Fire,£13.71,In stock,Three
What Happened on Beale Street (Secrets of the South Mysteries #2),£25.37,In stock,Five
The Bachelor Girl's Guide to Murder (Herringford and Watts Mysteries #1),£52.30,In stock,Five
Delivering the Truth (Quaker Midwife Mystery #1),£20.89,In stock,Four
The Mysterious Affair at Styles (Hercule Poirot #1),£24.80,In stock,Four
In the Woods (Dublin Murder Squad #1),£38.38,In stock,Two
The Silkworm (Cormoran Strike #2),£23.05,In stock,Five
The Exiled,£43.45,In stock,Three
The Cuckoo's Calling (Cormoran Strike #1),£19.21,In stock,One
Extreme Prey (Lucas Davenport #26),£25.40,In stock,Three
Career of Evil (Cormoran Strike #3),£24.72,In stock,Two
The No. 1 Ladies' Detective Agency (No. 1 Ladies' Detective Agency #1),£57.70,In stock,Four
The Girl You Lost,£12.29,In stock,Five
The Girl In The Ice (DCI Erika Foster #1),£15.85,In stock,Three
Blood Defense (Samantha Brinkman #1),£20.30,In stock,Three
1st to Die (Women's Murder Club #1),£53.98,In stock,One
Soumission,£50.10,In stock,One
Private Paris (Private #10),£47.61,In stock,Five
"We Love You, Charlie Freeman",£50.27,In stock,Five
Thirst,£17.27,In stock,Five
The Murder That Never Was (Forensic Instincts #5),£54.11,In stock,Three
Tuesday Nights in 1980,£21.04,In stock,Two
The Vacationers,£42.15,In stock,Four
The Regional Office Is Under Attack!,£51.36,In stock,Five
Finders Keepers (Bill Hodges Trilogy #2),£53.53,In stock,Five
The Time Keeper,£27.88,In stock,Five
The Testament of Mary,£52.67,In stock,Four
The First Hostage (J.B. Collins #2),£25.85,In stock,Three
Take Me with You,£45.21,In stock,Three
Still Life with Bread Crumbs,£26.41,In stock,Three
Shtum,£55.84,In stock,Four
My Name Is Lucy Barton,£41.56,In stock,One
My Mrs. Brown,£24.48,In stock,Three
Mr. Mercedes (Bill Hodges Trilogy #1),£28.90,In stock,One
I Am Pilgrim (Pilgrim #1),£10.60,In stock,Four
Eligible (The Austen Project #4),£27.09,In stock,Three
Eight Hundred Grapes,£14.39,In stock,Four
Dear Mr. Knightley,£11.21,In stock,Five
Cometh the Hour (The Clifton Chronicles #6),£25.01,In stock,Three
Balloon Animals,£17.03,In stock,Three
A Man Called Ove,£39.72,In stock,One
The Silent Sister (Riley MacPherson #1),£46.29,In stock,Five
The Dinner Party,£56.54,In stock,Two
The Improbability of Love,£59.45,In stock,One
Mothering Sunday,£13.34,In stock,Two
Lies and Other Acts of Love,£45.14,In stock,One
Daredevils,£16.34,In stock,Three
11/22/63,£48.48,In stock,Three
The Shack,£28.03,In stock,One
The High Mountains of Portugal,£51.15,In stock,One
Miller's Valley,£58.54,In stock,Two
Hystopia: A Novel,£21.96,In stock,Four
The Bourne Identity (Jason Bourne #1),£42.78,In stock,Four
Sister Dear,£40.20,In stock,Four
Memoirs of a Geisha,£49.67,In stock,Three
Me Before You (Me Before You #1),£19.02,In stock,One
Deception Point,£40.32,In stock,Four
The Little Paris Bookshop,£24.73,In stock,Three
The Firm,£45.56,In stock,Three
The Expatriates,£44.58,In stock,Two
Siddhartha,£34.22,In stock,Five
Last One Home (New Beginnings #1),£59.98,In stock,Three
Digital Fortress,£58.00,In stock,Five
Atlas Shrugged,£26.58,In stock,Five
Three-Martini Lunch,£23.21,In stock,Three
The Nightingale,£26.26,In stock,Four
The Infinities,£27.41,In stock,One
The Husband's Secret,£52.51,In stock,Five
The Da Vinci Code (Robert Langdon #2),£22.96,In stock,Two
The Art of Fielding,£22.10,In stock,One
Lila (Gilead #3),£12.47,In stock,Three
Jurassic Park (Jurassic Park #1),£44.97,In stock,One
Inferno (Robert Langdon #4),£41.00,In stock,Five
Crazy Rich Asians (Crazy Rich Asians #1),£49.13,In stock,Five
Big Little Lies,£22.11,In stock,One
The Course of Love,£16.78,In stock,Three
When I'm Gone,£51.96,In stock,Three
The Silent Wife,£12.34,In stock,Five
The Bette Davis Club,£30.66,In stock,Three
Kitchens of the Great Midwest,£57.20,In stock,Five
Bright Lines,£39.07,In stock,Five
Worlds Elsewhere: Journeys Around Shakespeare’s Globe,£40.30,In stock,Five
The Five Love Languages: How to Express Heartfelt Commitment to Your Mate,£31.05,In stock,Three
Reasons to Stay Alive,£26.41,In stock,Two
#HigherSelfie: Wake Up Your Life. Free Your Soul. Find Your Tribe.,£23.11,In stock,Five
"Unseen City: The Majesty of Pigeons, the Discreet Charm of Snails & Other Wonders of the Urban Wilderness",£44.18,In stock,Four
Throwing Rocks at the Google Bus: How Growth Became the Enemy of Prosperity,£31.12,In stock,Three
The Life-Changing Magic of Tidying Up: The Japanese Art of Decluttering and Organizing,£16.77,In stock,Three
The Gutsy Girl: Escapades for Your Life of Epic Adventure,£37.13,In stock,One
The Electric Pencil: Drawings from Inside State Hospital No. 3,£56.06,In stock,One
Spark Joy: An Illustrated Master Class on the Art of Organizing and Tidying Up,£41.83,In stock,Four
Reskilling America: Learning to Labor in the Twenty-First Century,£19.83,In stock,Two
In the Country We Love: My Family Divided,£22.00,In stock,Four
Everydata: The Misinformation Hidden in the Little Data You Consume Every Day,£54.35,In stock,Two
Call the Nurse: True Stories of a Country Nurse on a Scottish Isle,£29.14,In stock,Five
Algorithms to Live By: The Computer Science of Human Decisions,£30.81,In stock,One
The Power of Now: A Guide to Spiritual Enlightenment,£43.54,In stock,Two
The Omnivore's Dilemma: A Natural History of Four Meals,£38.21,In stock,Two
The Genius of Birds,£17.24,In stock,One
The Artist's Way: A Spiritual Path to Higher Creativity,£38.49,In stock,Five
So You've Been Publicly Shamed,£12.23,In stock,Two
"Daring Greatly: How the Courage to Be Vulnerable Transforms the Way We Live, Love, Parent, and Lead",£19.43,In stock,Three
Big Magic: Creative Living Beyond Fear,£30.80,In stock,Three
Becoming Wise: An Inquiry into the Mystery and Art of Living,£27.43,In stock,Two
Agnostic: A Spirited Manifesto,£12.51,In stock,Five
Whole Lotta Creativity Going On: 60 Fun and Unusual Exercises to Awaken and Strengthen Your Creativity,£38.20,In stock,Four
What's It Like in Space?: Stories from Astronauts Who've Been There,£19.60,In stock,Two
The Year of Magical Thinking,£43.04,In stock,Two
The Literature Book (Big Ideas Simply Explained),£17.43,In stock,Three
The Bad-Ass Librarians of Timbuktu: And Their Race to Save the World’s Most Precious Manuscripts,£15.77,In stock,One
Swell: A Year of Waves,£45.58,In stock,One
No Dream Is Too High: Life Lessons From a Man Who Walked on the Moon,£21.95,In stock,Two
Looking for Lovely: Collecting the Moments that Matter,£29.14,In stock,Five
Let It Out: A Journey Through Journaling,£26.79,In stock,Five
Hamilton: The Revolution,£58.79,In stock,Three
"Far & Away: Places on the Brink of Change: Seven Continents, Twenty-Five Years",£15.06,In stock,Four
"Eaternity: More than 150 Deliciously Easy Vegan Recipes for a Long, Healthy, Satisfied, Joyful Life",£51.75,In stock,Five
Buying In: The Secret Dialogue Between What We Buy and Who We Are,£37.80,In stock,Four
Brain on Fire: My Month of Madness,£49.32,In stock,Five
Abstract City,£56.37,In stock,Five
13 Hours: The Inside Account of What Really Happened In Benghazi,£27.06,In stock,One
The Lonely City: Adventures in the Art of Being Alone,£33.26,In stock,Two
The Diary of a Young Girl,£59.90,In stock,Three
Snatched: How A Drug Queen Went Undercover for the DEA and Was Kidnapped By Colombian Guerillas,£21.21,In stock,Three
Furiously Happy: A Funny Book About Horrible Things,£41.46,In stock,Four
"The Sleep Revolution: Transforming Your Life, One Night at a Time",£11.68,In stock,Four
"Mother, Can You Not?",£16.89,In stock,Five
A Mother's Reckoning: Living in the Aftermath of Tragedy,£19.53,In stock,Three
"10% Happier: How I Tamed the Voice in My Head, Reduced Stress Without Losing My Edge, and Found Self-Help That Actually Works",£24.57,In stock,Two
Chernobyl 01:23:40: The Incredible True Story of the World's Worst Nuclear Disaster,£35.92,In stock,Two
"Zero to One: Notes on Startups, or How to Build the Future",£34.06,In stock,Three
Why Not Me?,£17.76,In stock,One
When Breath Becomes Air,£39.36,In stock,Two
"The Midnight Assassin: Panic, Scandal, and the Hunt for America's First Serial Killer",£28.45,In stock,Four
Smarter Faster Better: The Secrets of Being Productive in Life and Business,£38.89,In stock,Five
Rising Strong,£21.82,In stock,Three
Man's Search for Meaning,£29.48,In stock,Three
"Love That Boy: What Two Presidents, Eight Road Trips, and My Son Taught Me About a Parent's Expectations",£25.06,In stock,Two
Living Forward: A Proven Plan to Stop Drifting and Get the Life You Want,£12.55,In stock,Three
I Will Find You,£44.21,In stock,One
Brazen: The Courage to Find the You That's Been Hiding,£19.22,In stock,Two
Between the World and Me,£56.91,In stock,Four
Being Mortal: Medicine and What Matters in the End,£55.06,In stock,Four
"A Murder Over a Girl: Justice, Gender, Junior High",£13.20,In stock,Three
For the Love: Fighting for Grace in a World of Impossible Standards,£45.13,In stock,Three
Finding God in the Ruins: How God Redeems Pain,£46.64,In stock,Two
The Man Who Mistook His Wife for a Hat and Other Clinical Tales,£59.45,In stock,Four
In Cold Blood,£49.98,In stock,Four
"Girl, Interrupted",£42.14,In stock,Three
Why Save the Bankers?: And Other Essays on Our Economic and Political Crisis,£48.67,In stock,Two
Talking to Girls About Duran Duran: One Young Man's Quest for True Love and a Cooler Haircut,£25.15,In stock,Four
My Mother Was Nuts,£31.63,In stock,Four
"Data, A Love Story: How I Gamed Online Dating to Meet My Match",£32.35,In stock,Three
The Jazz of Physics: The Secret Link Between Music and the Structure of the Universe,£38.71,In stock,Three
The Gunning of America: Business and the Making of American Gun Culture,£16.81,In stock,Four
The Geography of Bliss: One Grump's Search for the Happiest Places in the World,£28.23,In stock,Two
God Is Not Great: How Religion Poisons Everything,£27.80,In stock,One
We the People: The Modern-Day Figures Who Have Reshaped and Affirmed the Founding Fathers' Vision of America,£31.95,In stock,Three
Very Good Lives: The Fringe Benefits of Failure and the Importance of Imagination,£50.66,In stock,Three
"Unstuffed: Decluttering Your Home, Mind, and Soul",£58.09,In stock,One
Under the Banner of Heaven: A Story of Violent Faith,£30.00,In stock,One
"Trespassing Across America: One Man's Epic, Never-Done-Before (and Sort of Illegal) Hike Across the Heartland",£53.51,In stock,One
The Name of God is Mercy,£37.25,In stock,Two
Stiff: The Curious Lives of Human Cadavers,£36.74,In stock,Three
Spilled Milk: Based on a True Story,£49.51,In stock,One
"Rise of the Rocket Girls: The Women Who Propelled Us, from Missiles to the Moon to Mars",£41.67,In stock,Four
Outliers: The Story of Success,£14.16,In stock,One
Notes from a Small Island (Notes From a Small Island #1),£40.17,In stock,One
Night (The Night Trilogy #1),£13.51,In stock,One
"Miracles from Heaven: A Little Girl, Her Journey to Heaven, and Her Amazing Story of Healing",£57.83,In stock,One
Letter to a Christian Nation,£22.20,In stock,One
Let's Pretend This Never Happened: A Mostly True Memoir,£45.11,In stock,One
It's Never Too Late to Begin Again: Discovering Creativity and Meaning at Midlife and Beyond,£42.38,In stock,One
Into the Wild,£56.70,In stock,Five
"In the Garden of Beasts: Love, Terror, and an American Family in Hitler's Berlin",£28.85,In stock,Three
I Am Malala: The Girl Who Stood Up for Education and Was Shot by the Taliban,£28.88,In stock,Two
Gratitude,£26.66,In stock,Five
Disrupted: My Misadventure in the Start-Up Bubble,£15.28,In stock,Five
Brave Enough,£51.32,In stock,Five
"Born to Run: A Hidden Tribe, Superathletes, and the Greatest Race the World Has Never Seen",£27.35,In stock,Two
Blink: The Power of Thinking Without Thinking,£21.74,In stock,Five
Black Flags: The Rise of ISIS,£40.87,In stock,One
Are We Smart Enough to Know How Smart Animals Are?,£56.58,In stock,One
A Walk in the Woods: Rediscovering America on the Appalachian Trail,£30.48,In stock,Four
"The Suffragettes (Little Black Classics, #96)",£11.89,In stock,Two
Kindle Paperwhite User's Guide,£34.00,In stock,Three
H is for Hawk,£57.42,In stock,Five
Travels with Charley: In Search of America,£57.82,In stock,Five
The Tumor,£41.56,In stock,Five
The End of the Jesus Era (An Investigation #1),£14.40,In stock,One
"Eat, Pray, Love",£51.32,In stock,Three
